{
  "schema_version": "dramago.planning-baseline/v1",
  "artifact_id": "art_planning_baseline",
  "version_id": "av_planning_baseline_1",
  "content_digest": "sha256:776cf05ce86a7e5f81bb15534b76977f9d935827722c6026292d87415efd1486",
  "planning_baseline_id": "pb_example",
  "manifest": {
    "schema_version": "dramago.planning-manifest/v1",
    "workspace_id": "ws_example",
    "project_id": "project_example",
    "range_id": "range_season_1",
    "range_definition_ref": {
      "artifact_id": "art_range",
      "version_id": "av_range_1",
      "content_digest": "sha256:eaf60343b80bb5365cb1e2daf930c7d69416fc59bf4c3701939244e17f7dbbeb"
    },
    "story_foundation": {
      "artifact_id": "art_foundation",
      "version_id": "av_foundation_1",
      "content_digest": "sha256:79c6396ece98b57664548758a1855448db3412576b4999a96fb22372b08835eb"
    },
    "story_bible": {
      "artifact_id": "art_bible",
      "version_id": "av_bible_1",
      "content_digest": "sha256:e2b9ed9e89c86e8e99840504433eec80a235b1f62d17f7ecee1c65f797232437"
    },
    "master_outline": {
      "artifact_id": "art_master",
      "version_id": "av_master_1",
      "content_digest": "sha256:c055fe88c82006407c282d8c1beb51741de0134a7f3abce92de4e67643f71060"
    },
    "season_architecture": {
      "artifact_id": "art_architecture",
      "version_id": "av_architecture_1",
      "content_digest": "sha256:0bc6131619d0fd33e5915bb8809e85ae4253866436df2531fac23b6a968c2b38"
    },
    "ordered_episodes": [
      {
        "episode_id": "EP01",
        "outline_ref": {
          "artifact_id": "art_outline_ep01",
          "version_id": "av_outline_ep01_1",
          "content_digest": "sha256:97f6baacb291b033814c2d4a794532203f46e5bc053d1b4a0ffc352c9123ddc7"
        }
      },
      {
        "episode_id": "EP02",
        "outline_ref": {
          "artifact_id": "art_outline_ep02",
          "version_id": "av_outline_ep02_1",
          "content_digest": "sha256:2d8729606950136124ba7586e83346aeef99e3c5e21ad17d6f803395c5055313"
        }
      }
    ],
    "review_evidence": [
      {
        "evidence_ref": {
          "artifact_id": "art_planning_review",
          "version_id": "av_planning_review_1",
          "content_digest": "sha256:2d4d5a13977d35cfadc1970d49354f2df108408ea5f2c1fa4a8df127ea6992fd"
        },
        "subject_refs": [
          {
            "artifact_id": "art_range",
            "version_id": "av_range_1",
            "content_digest": "sha256:eaf60343b80bb5365cb1e2daf930c7d69416fc59bf4c3701939244e17f7dbbeb"
          },
          {
            "artifact_id": "art_foundation",
            "version_id": "av_foundation_1",
            "content_digest": "sha256:79c6396ece98b57664548758a1855448db3412576b4999a96fb22372b08835eb"
          },
          {
            "artifact_id": "art_bible",
            "version_id": "av_bible_1",
            "content_digest": "sha256:e2b9ed9e89c86e8e99840504433eec80a235b1f62d17f7ecee1c65f797232437"
          },
          {
            "artifact_id": "art_master",
            "version_id": "av_master_1",
            "content_digest": "sha256:c055fe88c82006407c282d8c1beb51741de0134a7f3abce92de4e67643f71060"
          },
          {
            "artifact_id": "art_architecture",
            "version_id": "av_architecture_1",
            "content_digest": "sha256:0bc6131619d0fd33e5915bb8809e85ae4253866436df2531fac23b6a968c2b38"
          },
          {
            "artifact_id": "art_outline_ep01",
            "version_id": "av_outline_ep01_1",
            "content_digest": "sha256:97f6baacb291b033814c2d4a794532203f46e5bc053d1b4a0ffc352c9123ddc7"
          },
          {
            "artifact_id": "art_outline_ep02",
            "version_id": "av_outline_ep02_1",
            "content_digest": "sha256:2d8729606950136124ba7586e83346aeef99e3c5e21ad17d6f803395c5055313"
          }
        ],
        "outcome": "PASS"
      }
    ],
    "policy_version": "planning-baseline/v1"
  },
  "created_at": "2026-01-01T00:00:00Z",
  "approval_refs": [
    {
      "artifact_id": "art_approval_planning",
      "version_id": "av_approval_planning_1",
      "content_digest": "sha256:140db834e7b7b681de698f67a79fba026b88c242c49f307a86095fb89f564cb6"
    }
  ]
}
